{
  "slug": "express",
  "repo": "expressjs/express",
  "name": "Express.js",
  "description": "The most popular Node.js web framework. Learn routing, middleware, and request handling.",
  "tags": [
    "JavaScript",
    "Web Framework",
    "REST API"
  ],
  "depth": "high-level",
  "expertise": "amateur",
  "overview": "Of course! Let's dive into Express.js, one of the most foundational and influential libraries in the Node.js ecosystem.\n\nIt's described as a \"Fast, unopinionated, minimalist web framework,\" and as we'll see, that's not just marketing speak\u2014it's the core of its entire architecture.\n\n### 1. The Big Picture: A Minimalist Glue\n\nThe most important thing to understand about Express is what it *isn't*. It's not a monolithic framework that includes everything from a database ORM to a templating language. Instead, its core design philosophy is to be a minimal and flexible \"glue\" for building web applications.\n\nThis is immediately obvious when you look at its dependencies in `package.json`:\n\n```json\n\"dependencies\": {\n  \"body-parser\": \"^2.2.1\",\n  \"router\": \"^2.2.0\",\n  \"serve-static\": \"^2.2.0\",\n  \"accepts\": \"^2.0.0\",\n  \"cookie\": \"^0.7.1\",\n  ...\n}\n```\n\nKey functionalities you'd expect in a web framework are actually separate, focused libraries:\n*   **Routing:** The entire logic for matching URLs to code is handled by the `router` package.\n*   **Static File Serving:** Serving files like CSS and JavaScript is handled by `serve-static`.\n*   **Request Body Parsing:** Understanding incoming JSON or form data is handled by `body-parser`.\n\n**Design Decision:** Express delegates core tasks to specialized, smaller modules. This keeps the Express codebase itself focused on one primary job: **managing a pipeline of functions (middleware) that handle HTTP requests.** This \"small modules\" approach makes the system more maintainable, testable, and allows developers to swap out pieces or only include what they absolutely need.\n\n### 2. The Heart of Express: The Middleware Pipeline\n\nIf you remember one thing about Express, it should be the **middleware pattern**. This is the architectural backbone of the entire framework.\n\nA middleware is just a function with a specific signature: `(req, res, next)`.\n\n1.  `req`: The request object, enhanced by Express.\n2.  `res`: The response object, enhanced by Express.\n3.  `next`: A function that passes control to the *next* middleware in the chain.\n\nThink of it like an assembly line for your HTTP request. When a request comes in, it's passed to the first middleware function. That function can do some work (like log the request, check for an API key, parse a request body) and then has a choice:\n*   **End the cycle:** Send a response to the client (e.g., `res.send('Hello!')`). The assembly line stops here.\n*   **Pass it on:** Call `next()` to hand the request to the next middleware function in the line.\n*   **Handle an error:** Call `next(new Error(...))` to skip all remaining regular middleware and go straight to the error handlers.\n\nThis pattern is what makes Express so \"unopinionated.\" The framework doesn't care *what* you do in the middleware, it just provides the structure for you to chain them together.\n\nYou can see this clearly in `examples/route-middleware/index.js`, which defines several small, single-purpose functions:\n\n```javascript\n// examples/route-middleware/index.js\n\n// Middleware to load a user from a fake DB\nfunction loadUser(req, res, next) {\n  var user = users[req.params.id];\n  if (user) {\n    req.user = user;\n    next(); // Pass to the next function\n  } else {\n    next(new Error('Failed to load user ' + req.params.id)); // Pass an error\n  }\n}\n\n// Middleware to check for permissions\nfunction andRestrictToSelf(req, res, next) {\n  if (req.authenticatedUser.id === req.user.id) {\n    next(); // All good, pass it on\n  } else {\n    next(new Error('Unauthorized')); // Error, go to error handlers\n  }\n}\n\n// The route definition chains them together\napp.get('/user/:id/edit', loadUser, andRestrictToSelf, function(req, res){\n  res.send('Editing user ' + req.user.name); // This is the final step\n});\n```\nThis is a beautiful demonstration of the architecture: building complex logic by composing simple, reusable functions.\n\n### 3. Application and Routing Architecture\n\nSo how does Express manage this pipeline?\n\n#### The `app` Object\nThe main entry point, `lib/express.js`, creates the `app` object.\n\n```javascript\n// lib/express.js\n\nfunction createApplication() {\n  var app = function(req, res, next) {\n    app.handle(req, res, next);\n  };\n\n  mixin(app, EventEmitter.prototype, false);\n  mixin(app, proto, false);\n  // ...\n  app.init();\n  return app;\n}\n```\nThis is a classic JavaScript pattern. The `app` you create with `express()` is actually a function! This allows you to use an Express app as a callback for Node's `http.createServer`, making it compatible with the core Node ecosystem. Properties and methods like `.listen()`, `.use()`, and `.get()` are mixed into this function object from `lib/application.js`.\n\n#### The Router\nThe `app` object is essentially the top-level router. It uses the `router` package to manage all the routes you define with `app.get()`, `app.post()`, etc.\n\nA key architectural feature is the concept of **sub-routers**. You can create modular pieces of your application and mount them at specific paths. This is crucial for organizing larger applications. The `examples/multi-router/index.js` file shows this perfectly:\n\n```javascript\n// examples/multi-router/index.js\n\nvar express = require('../..');\nvar app = module.exports = express();\n\n// A self-contained router for API v1\nvar apiv1 = require('./controllers/api_v1');\n// Another for API v2\nvar apiv2 = require('./controllers/api_v2');\n\n// Mount the routers on specific paths\napp.use('/api/v1', apiv1);\napp.use('/api/v2', apiv2);\n```\nHere, the main `app` doesn't need to know anything about the routes inside `api_v1` or `api_v2`. It just delegates any request starting with `/api/v1` to the `apiv1` router. This is a powerful form of separation of concerns.\n\n### 4. Enhancing Node's `req` and `res`\n\nA major reason for Express's popularity is the developer experience it provides by abstracting away the raw, sometimes clunky, Node.js `http` objects. It does this by creating custom prototypes for the request and response objects.\n\n*   `lib/request.js`: This file defines helpers that get attached to the `req` object. It adds convenient properties and methods like `req.path`, `req.query`, `req.params`, and `req.get('header-name')`. You no longer have to parse the URL yourself; Express does it for you.\n*   `lib/response.js`: This is even more powerful. It adds the methods that developers use constantly, like `res.send()`, `res.json()`, `res.status()`, and `res.render()`. These methods handle the boilerplate of setting headers (`Content-Type`), serializing data to JSON, and ending the response.\n\nThis design decision focuses on ergonomics. By providing these extended objects to every middleware, Express makes the process of handling requests and sending responses far more intuitive and less error-prone than using Node's raw APIs.\n\n### 5. The View Layer: Pluggable by Design\n\nTrue to its \"unopinionated\" nature, Express has a concept of a view rendering system but doesn't force a specific one on you.\n\nThe logic is contained in `lib/view.js`. This file is an abstraction layer. Its job is to:\n1.  Find the template file on disk based on the `views` directory setting.\n2.  Find the correct rendering engine for the file's extension (e.g., `.ejs`, `.pug`).\n3.  Call that engine with the template file, data, and a callback.\n\nYou \"plug in\" an engine using `app.engine()`. The `examples/markdown/index.js` file has a great, non-standard example of this:\n\n```javascript\n// examples/markdown/index.js\n\n// Register .md as a template engine\napp.engine('md', function(path, options, fn){\n  fs.readFile(path, 'utf8', function(err, str){\n    if (err) return fn(err);\n    var html = marked.parse(str) // Uses the 'marked' library\n    // ... logic to replace variables ...\n    fn(null, html);\n  });\n});\n\napp.set('view engine', 'md'); // Make it the default\n\napp.get('/', function(req, res){\n  // Express now knows how to render .md files!\n  res.render('index', { title: 'Markdown Example' });\n});\n```\nThis shows the power of the abstraction. Express doesn't need to know *how* to parse Markdown; it just needs a function that conforms to its engine interface.\n\n### Conclusion\n\nThe architecture of Express is a masterclass in the Node.js philosophy of small, composable modules.\n\n*   **Minimal Core:** It provides the absolute minimum needed: a way to create a server and manage a middleware chain.\n*   **Middleware Pipeline:** Its central architecture is a flexible and powerful assembly line for processing requests. This is its defining feature.\n*   **Delegation:** It delegates major tasks like routing and static file serving to other specialized libraries, keeping itself lean.\n*   **Developer Experience:** It enhances Node's core `req` and `res` objects with a rich set of helpers that dramatically simplify web development.\n*   **Unopinionated Structure:** Through sub-routers and pluggable view engines, it provides the tools to structure an application without dictating *how* it must be structured.\n\nBy focusing on being the \"glue\" rather than the entire machine, Express created an ecosystem where developers can pick and choose the best tools for their specific needs, making it one of the most enduring and successful frameworks in web development.",
  "podcast": "*(Intro music with a modern, clean, slightly electronic feel fades in and then fades to a background hum)*\n\nALEX: Hello and welcome to RepoLM, the podcast where we dive deep into the code that powers our digital world. I\u2019m your host, Alex.\n\nSAM: And I\u2019m Sam. Each week, we pick a repository, pop the hood, and see what makes it tick. We\u2019re not just reading code line-by-line; we\u2019re looking for the big ideas, the architectural choices, and the design philosophies behind it.\n\nALEX: And this week, we\u2019re looking at an absolute giant of the Node.js ecosystem. If you\u2019ve ever built a web server with Node, you\u2019ve almost certainly used it or something inspired by it. We are talking about `expressjs/express`.\n\nSAM: That\u2019s right. The self-described \"Fast, unopinionated, minimalist web framework.\" For a long time, Express *was* the default answer to \"How do I build a web app in Node.js?\" It's foundational.\n\nALEX: Exactly. And I\u2019m excited to dig in. Looking at the repo for the first time, it\u2019s got a pretty classic structure. There\u2019s a `lib` directory for the source, a massive `test` directory, and a really interesting `examples` directory. Where do you want to start, Sam?\n\nSAM: Let's start with what's *not* there. For a framework that does so much, the `lib` directory is shockingly small. Open it up. You\u2019ve got `application.js`, `express.js`, `request.js`, `response.js`, `utils.js`, and `view.js`. That\u2019s it. Six files.\n\nALEX: Wow, you\u2019re right. I was expecting dozens of files for something this powerful. How can it be so small?\n\nSAM: That's the first and most important architectural decision of Express. It\u2019s not a monolith; it\u2019s a master delegator.\n\nALEX: A delegator? What do you mean?\n\nSAM: Think of Express as a brilliant restaurant manager. The manager doesn\u2019t cook the food, they don\u2019t make the plates, and they don't build the tables. They hire the best chef for the job, choose the best decor, and create a system for how customers are seated and served. Express does the same thing for web development. Its core job is to manage and connect a series of specialized functions called middleware.\n\nALEX: Ah, middleware. The famous Express pattern. I see `app.use()` all over the `examples` directory. Can you break that down for us?\n\nSAM: Absolutely. Middleware is the heart and soul of Express. The entire architecture is built on it. Imagine an assembly line for a car. A request comes in, and it\u2019s just a bare metal chassis. It moves down the line. The first middleware function bolts on the wheels. The next one installs the engine. A third one paints the body. Each function does one specific job and then passes the car down to the next station by calling a function, usually named `next()`.\n\nALEX: So a request comes in, `body-parser` middleware might process the request body, `cookie-parser` might handle cookies, and so on, until it finally hits my actual route handler that sends a response.\n\nSAM: Precisely. And if we look at the `package.json`, we see this philosophy in action. Look at the dependencies: `body-parser`, `cookie`, `router`, `serve-static`. Express itself doesn't actually parse a JSON request body or serve a static file. It uses these other, highly-focused modules to do the heavy lifting. Express's job is just to provide the assembly line itself.\n\nALEX: That makes so much sense. So the core of Express in that tiny `lib` folder is really just the machinery for that assembly line.\n\nSAM: You got it. Let's look at `lib/express.js`. This is the entry point. It\u2019s a factory function called `createApplication`. It creates the `app` object that we all know and love. And look at what it does: it takes a blank function, and uses `mixin` to merge in the properties from `EventEmitter` and from `lib/application.js`.\n\nALEX: So `application.js` is where the methods like `app.get()`, `app.post()`, and `app.use()` are actually defined.\n\nSAM: Exactly. That file is the blueprint for the application object. It manages the middleware stack and the routing. But notice, it doesn't handle the routing logic itself. It uses the `router` package for that. Another delegation!\n\nALEX: So it's layers all the way down. What about `request.js` and `response.js`?\n\nSAM: This is another genius move. Node\u2019s built-in HTTP server gives you a basic request and response object. They work, but they\u2019re a bit raw. You have to manually set headers, stringify JSON, and end the response stream. It's tedious.\n\nALEX: I\u2019ve been there. `res.writeHead()`, `res.end()`... it feels very low-level.\n\nSAM: Right. So what Express does is it takes Node's native request and response objects and extends them. `request.js` and `response.js` are prototypes. Express creates new objects that inherit from these prototypes, giving you all these wonderful helper methods like `res.json()`, which handles the stringifying and setting the `Content-Type` header for you, or `res.send()`, which is smart enough to handle different data types. It\u2019s not replacing Node's core; it\u2019s just putting a much friendlier, more ergonomic API on top of it.\n\nALEX: So it\u2019s not reinventing the wheel, it\u2019s just adding power steering and comfortable seats.\n\nSAM: Perfect analogy. It makes the developer experience so much better. And because it just extends the native objects, any other library that works with Node's standard `req` and `res` objects will still work perfectly inside Express.\n\nALEX: Okay, let's talk about the \"unopinionated\" part of its description. The `package.json` calls it a \"minimalist, unopinionated web framework\". We\u2019ve seen the minimalism in the `lib` directory, but where does the \"unopinionated\" part show up?\n\nSAM: The best place to see that is the `examples` directory. It is massive and incredibly diverse.\n\nALEX: It really is. There are over 25 distinct examples in here. We've got `auth`, `cookie-sessions`, `ejs`, `markdown`, `mvc`, `multi-router`, `route-separation`... it's a catalog of patterns.\n\nSAM: And that's the point. An \"opinionated\" framework would say, \"Here is the one true way to structure your application. Put your models here, your views here, and your controllers here.\" Express doesn't do that.\n\nALEX: So it\u2019s giving you the tools, but not the blueprint.\n\nSAM: Exactly. Look at the `mvc` example. It shows a way to build a classic Model-View-Controller application, with controllers in their own directory. But right next to it, you have the `route-separation` example, which organizes routes by resource into separate files like `user.js` and `post.js`. Neither is \"the Express way.\" They are just *ways* you can do it *with* Express.\n\nALEX: And the same for view engines. The `ejs` example shows how to use Embedded JavaScript templates, but the `markdown` example shows you how to wire up a Markdown renderer as your template engine. Express doesn't care what you use, as long as it conforms to the engine API.\n\nSAM: That is the essence of being unopinionated. It provides the routing and middleware pipeline, and the rest is up to you. It gives you freedom, which can be a double-edged sword for beginners, but is incredibly powerful for experienced developers who want to make their own architectural choices. The `examples` folder isn't just for learning; it's a statement of philosophy.\n\nALEX: That\u2019s a great way to put it. I want to shift gears to testing. The `test` directory is huge, even bigger than the `lib` and `examples` directories combined. What can we learn from their testing strategy?\n\nSAM: The testing strategy is a masterclass in ensuring a library is robust. First, you have granular unit tests for almost every single public method. There are separate files like `test/req.path.js`, `test/res.send.js`, `test/req.accepts.js`. They are incredibly thorough, testing every edge case.\n\nALEX: That makes sense for a foundational library. You need that level of confidence.\n\nSAM: But the really clever part is the `test/acceptance` directory. Take a look at `test/acceptance/hello-world.js`. What does it do?\n\nALEX: Let\u2019s see... it does a `require('../../examples/hello-world')`... oh! It's importing the actual example file. Then it uses `supertest` to make an HTTP request to that example app and asserts that it gets \"Hello World\" back.\n\nSAM: Isn't that brilliant? They don't just write examples; they write tests that *run* the examples. This serves two purposes. First, it's a suite of high-level integration tests that ensure all the pieces work together in a real-world scenario. Second, it guarantees that their documentation\u2014the examples\u2014never goes out of date. If a code change breaks an example, the tests fail.\n\nALEX: That is so smart. It's like self-verifying documentation. You know that every pattern they show you in the `examples` folder actually works, because it's part of their CI pipeline.\n\nSAM: It's a pattern more projects should adopt. It builds a huge amount of trust in the library.\n\nALEX: So, to wrap this up, if you had to distill the architecture of Express down to a few key principles, what would they be?\n\nSAM: I'd say there are three. First, **composition over configuration**. Build your app by composing small, single-purpose middleware functions, rather than configuring a giant framework object.\n\nALEX: The assembly line.\n\nSAM: Exactly. Second, **delegate, don't reinvent**. Express leverages the best-in-class libraries for things like routing, body parsing, and serving files instead of trying to build it all itself. This keeps the core small, focused, and maintainable.\n\nALEX: The restaurant manager.\n\nSAM: You\u2019re getting the hang of my analogies! And third, **provide ergonomic helpers, not rigid structure**. It enhances the native Node APIs to make developers' lives easier with methods like `res.json()` and `req.params`, but it doesn't force you into a specific application structure. It's a toolkit, not a cage.\n\nALEX: It's amazing how these principles, established over a decade ago, still feel so modern and relevant. Diving into this codebase, you can really feel the DNA of so much of the Node.js ecosystem that came after it.\n\nSAM: It truly set the standard. Express taught a generation of developers how to think about building web services in Node.js. It\u2019s less of a framework and more of a pattern, and its influence is undeniable. It\u2019s a beautiful piece of software history that\u2019s still going strong.\n\nALEX: A fantastic breakdown, Sam. That\u2019s all the time we have for this week. A huge thank you for joining us on RepoLM. You can find a link to the Express repository in our show notes.\n\nSAM: Happy coding, everyone.\n\n*(Outro music fades in)*\n\nALEX: Join us next time as we explore another fascinating codebase. Until then, I'm Alex.\n\nSAM: And I'm Sam.\n\n*(Music swells and fades out)*",
  "slides": "# Express.js\n## Fast, Unopinionated Web Framework for Node.js\n\n*A deep dive into one of the most influential server-side frameworks ever built*\n---\n# What is Express?\n\n- **Minimalist** web framework for Node.js\n- Created by TJ Holowaychuk in 2010\n- Over **64,000 GitHub stars**\n- Used by: Uber, IBM, Accenture, and millions of developers\n\n> \"Express is the de facto standard server framework for Node.js\"\n---\n# Core Philosophy\n\n## \"Unopinionated & Minimal\"\n\n- Thin layer on top of Node's HTTP module\n- No prescribed project structure\n- No mandated database, ORM, or templating engine\n- You compose your app from **middleware functions**\n\nThink of it as the **glue** \u2014 not the entire building.\n---\n# Architecture Overview\n\n```\nClient Request\n     |\n     v\n+-------------------+\n|   Express App     |\n|  +--------------+ |\n|  | Middleware 1 |-> logging\n|  | Middleware 2 |-> body parsing  \n|  | Middleware 3 |-> authentication\n|  |   Router     |-> route matching\n|  | Middleware N |-> error handling\n|  +--------------+ |\n+-------------------+\n     |\n     v\n  Response\n```\n\nEverything flows through the **middleware pipeline**.\n---\n# The Middleware Pattern\n\nThe heart of Express \u2014 every request passes through a chain of functions:\n\n```javascript\n// Signature: (req, res, next) => void\napp.use((req, res, next) => {\n  console.log(req.method, req.url);\n  next(); // Pass to next middleware\n});\n\napp.use(express.json());    // Parse JSON bodies\napp.use(cors());            // Handle CORS\napp.use(helmet());          // Security headers\n```\n\nEach middleware can **modify**, **end**, or **pass** the request.\n---\n# Routing\n\n```javascript\n// Basic routes\napp.get('/users', getUsers);\napp.post('/users', createUser);\napp.put('/users/:id', updateUser);\napp.delete('/users/:id', deleteUser);\n\n// Route parameters\napp.get('/users/:userId/posts/:postId', (req, res) => {\n  // req.params = { userId: '123', postId: '456' }\n});\n\n// Query strings: GET /search?q=express&page=2\napp.get('/search', (req, res) => {\n  // req.query = { q: 'express', page: '2' }\n});\n```\n---\n# The Router: Modular Routes\n\nSplit your app into manageable pieces:\n\n```javascript\n// routes/users.js\nconst router = express.Router();\nrouter.get('/', listUsers);\nrouter.post('/', createUser);\nrouter.get('/:id', getUser);\nmodule.exports = router;\n\n// app.js\nconst usersRouter = require('./routes/users');\napp.use('/api/users', usersRouter);\n```\n\nRouters are **mini Express apps** with their own middleware stacks.\n---\n# Request & Response Enhancement\n\nExpress wraps Node's raw HTTP objects:\n\n```javascript\n// Request helpers\nreq.params      // Route parameters\nreq.query       // Query string parsed\nreq.body        // Parsed request body\nreq.get('Host') // Header access\n\n// Response helpers\nres.json({ ok: true })        // Send JSON\nres.status(404).send('Nope')  // Status + body\nres.redirect('/login')        // Redirect\nres.render('index', { data }) // Template rendering\n```\n---\n# Error Handling\n\n```javascript\n// Error-handling middleware (note the 4 params!)\napp.use((err, req, res, next) => {\n  console.error(err.stack);\n  res.status(err.status || 500).json({\n    error: err.message\n  });\n});\n\n// Throwing errors in routes\napp.get('/danger', (req, res, next) => {\n  try {\n    riskyOperation();\n  } catch (err) {\n    next(err); // Forward to error handler\n  }\n});\n```\n\nErrors skip regular middleware \u2014 go straight to error handlers.\n---\n# The Source Code\n\nExpress's `lib/` directory is surprisingly small:\n\n- **express.js** \u2014 Factory function, creates the app\n- **application.js** \u2014 App methods: .use(), .get(), .listen()\n- **request.js** \u2014 Enhanced request prototype\n- **response.js** \u2014 Enhanced response prototype\n- **router/** \u2014 URL matching and route dispatch\n- **view.js** \u2014 Template engine integration\n\n**~2,500 lines of code** power millions of applications.\n---\n# Template Engines\n\nExpress is engine-agnostic:\n\n```javascript\n// Use EJS\napp.set('view engine', 'ejs');\n\n// Use Pug\napp.set('view engine', 'pug');\n\n// Custom engine\napp.engine('md', (path, opts, cb) => {\n  fs.readFile(path, 'utf8', (err, str) => {\n    cb(null, marked.parse(str));\n  });\n});\n\n// Render a template\napp.get('/', (req, res) => {\n  res.render('index', { title: 'Home', user });\n});\n```\n---\n# Real-World Pattern: REST API\n\n```javascript\nconst express = require('express');\nconst app = express();\napp.use(express.json());\n\n// Auth middleware\nconst auth = (req, res, next) => {\n  const token = req.headers.authorization;\n  if (!token) return res.status(401).json({ error: 'No token' });\n  req.user = verifyToken(token);\n  next();\n};\n\napp.get('/api/posts', auth, async (req, res) => {\n  const posts = await db.posts.findAll({ userId: req.user.id });\n  res.json(posts);\n});\n\napp.listen(3000);\n```\n---\n# Express 5.x: What's New\n\n- **Promise support**: Async errors automatically caught\n- **Removed**: Legacy quirks and deprecated APIs\n- **Path matching**: Stricter, more predictable regex\n- **Dependencies**: Modernized internals\n\n```javascript\n// Express 5: async errors just work!\napp.get('/data', async (req, res) => {\n  const data = await fetchData(); // Throws? Auto-caught!\n  res.json(data);\n});\n```\n---\n# Key Takeaways\n\n1. **Middleware is everything** \u2014 Express is a middleware pipeline\n2. **Minimal core** \u2014 6 files, ~2500 lines\n3. **Composition over configuration** \u2014 build with small functions\n4. **Router modularity** \u2014 sub-routers for clean architecture\n5. **Unopinionated** \u2014 pick your own tools\n\n### Express taught a generation of developers how to build web servers.\n\n*It's not just a framework \u2014 it's a pattern.*\n---\n# Try It Yourself\n\n```bash\nmkdir my-api && cd my-api\nnpm init -y\nnpm install express\n```\n\n```javascript\nconst express = require('express');\nconst app = express();\napp.get('/', (req, res) => res.send('Hello!'));\napp.listen(3000);\n```\n\n**Start small. Compose middleware. Build something great.**"
}